{
  "id": "cursor",
  "contract_version": 1,
  "render_module": "kingstack.adapters.cursor",
  "native_home": ".cursor",
  "owned_paths": [
    "AGENTS.md",
    "hooks.json",
    "hooks/run.py",
    "skills/architect",
    "skills/arena",
    "skills/automate-me",
    "skills/blast-radius",
    "skills/bro",
    "skills/cli-for-agents",
    "skills/control-cli",
    "skills/control-ui",
    "skills/create-verification-skill",
    "skills/deslop",
    "skills/figure-it-out",
    "skills/how",
    "skills/interrogate",
    "skills/king-mode",
    "skills/maintain-verification-skill",
    "skills/make-pr-easy-to-review",
    "skills/memory-review",
    "skills/no-comments",
    "skills/poteto-mode",
    "skills/principle-boundary-discipline",
    "skills/principle-build-the-lever",
    "skills/principle-encode-lessons-in-structure",
    "skills/principle-exhaust-the-design-space",
    "skills/principle-experience-first",
    "skills/principle-fix-root-causes",
    "skills/principle-foundational-thinking",
    "skills/principle-guard-the-context-window",
    "skills/principle-laziness-protocol",
    "skills/principle-make-operations-idempotent",
    "skills/principle-migrate-callers-then-delete-legacy-apis",
    "skills/principle-minimize-reader-load",
    "skills/principle-model-the-domain",
    "skills/principle-never-block-on-the-human",
    "skills/principle-outcome-oriented-execution",
    "skills/principle-prove-it-works",
    "skills/principle-redesign-from-first-principles",
    "skills/principle-separate-before-serializing-shared-state",
    "skills/principle-sequence-verifiable-units",
    "skills/principle-subtract-before-you-add",
    "skills/principle-type-system-discipline",
    "skills/recall",
    "skills/reflect",
    "skills/show-me-your-work",
    "skills/swarm",
    "skills/tdd",
    "skills/teach",
    "skills/technical-writing",
    "skills/thermo-nuclear-code-quality-review",
    "skills/thermo-nuclear-review",
    "skills/typescript-best-practices",
    "skills/unslop",
    "skills/verify-this",
    "skills/why"
  ],
  "model_tiers": "models.json",
  "capability_matrix": {
    "contract_version": 1,
    "adapter_id": "cursor",
    "capabilities": [
      {
        "capability": "global_guidance",
        "status": "emulated",
        "evidence": "Kingstack renders AGENTS.md for Cursor Agent from the shared instruction fragments.",
        "impact": "Cursor has no Claude-style CLAUDE.md; guidance is supplied as AGENTS.md.",
        "strict_parity": true
      },
      {
        "capability": "skill_catalog",
        "status": "emulated",
        "evidence": "The Cursor portable subset is the same 53 bundled skills as Codex. Twelve plugin-managed names stay Claude/plugin-owned.",
        "impact": "The bundle is proven. Live Cursor home is not linked.",
        "strict_parity": true
      },
      {
        "capability": "session_start",
        "status": "emulated",
        "evidence": "The Cursor bundle includes hooks/run.py over the portable handlers and the shared memory store.",
        "impact": "The bundle is proven. Live Cursor home is not linked.",
        "strict_parity": true
      },
      {
        "capability": "stop_capture",
        "status": "emulated",
        "evidence": "The Cursor bundle includes hooks/run.py over the portable handlers and the shared memory store.",
        "impact": "The bundle is proven. Live Cursor home is not linked.",
        "strict_parity": true
      },
      {
        "capability": "before_compaction",
        "status": "emulated",
        "evidence": "The Cursor bundle includes hooks/run.py over the portable handlers and the shared memory store.",
        "impact": "The bundle is proven. Live Cursor home is not linked.",
        "strict_parity": true
      },
      {
        "capability": "post_tool_use",
        "status": "emulated",
        "evidence": "The Cursor bundle includes hooks/run.py over the portable handlers and the shared memory store.",
        "impact": "The bundle is proven. Live Cursor home is not linked.",
        "strict_parity": true
      },
      {
        "capability": "subagent_start",
        "status": "emulated",
        "evidence": "The Cursor bundle includes hooks/run.py over the portable handlers and the shared memory store.",
        "impact": "The bundle is proven. Live Cursor home is not linked.",
        "strict_parity": true
      },
      {
        "capability": "model_routing",
        "status": "emulated",
        "evidence": "Kingstack maps portable work classes through the Cursor-owned model map.",
        "impact": "Cursor model picker remains user-controlled; policy is advisory in guidance.",
        "strict_parity": true
      },
      {
        "capability": "shared_memory",
        "status": "emulated",
        "evidence": "The Cursor bundle includes hooks/run.py over the portable handlers and the shared memory store.",
        "impact": "The bundle is proven. Live Cursor home is not linked.",
        "strict_parity": true
      },
      {
        "capability": "schedules",
        "status": "unsupported",
        "evidence": "No Cursor-native scheduled-task equivalent is staged.",
        "impact": "Unattended workflows stay on launchd/Claude.",
        "strict_parity": false
      },
      {
        "capability": "health",
        "status": "emulated",
        "evidence": "kingstack check --contract --adapter cursor validates the declaration.",
        "impact": "There is no Cursor-native health surface.",
        "strict_parity": true
      },
      {
        "capability": "activation",
        "status": "emulated",
        "evidence": "Private-runtime activate exists and refuses ~/.cursor.",
        "impact": "No live Cursor home may be linked until Hassan approves.",
        "strict_parity": false
      },
      {
        "capability": "rollback",
        "status": "emulated",
        "evidence": "Private-runtime rollback retargets current and refuses ~/.cursor.",
        "impact": "There is no live Cursor link to roll back.",
        "strict_parity": false
      }
    ]
  }
}
